,0,1,2,3,4,5,6,7,8,9,10,11,12,13,14,15,16,17,18,19,20,21,22,23
Actinobacteria Actinobacteria Bifidobacteriales Bifidobacteriaceae,0,2,0,0,0,0,0,0,0,0,0,0,0,0,0,0,0,0,0,0,0,0,0,0
Actinobacteria Actinobacteria Geodermatophilales Geodermatophilaceae,0,0,0,0,0,0,0,0,0,0,0,0,0,0,0,0,0,0,0,0,0,0,0,0
Actinobacteria Actinobacteria Mycobacteriales Lawsonellaceae,0,0,0,0,0,0,0,0,0,0,0,0,0,0,0,0,0,0,0,0,0,0,0,0
Actinobacteria Actinobacteria Propionibacteriales Nocardioidaceae,0,0,0,0,0,0,0,0,0,0,0,0,0,0,0,0,0,0,0,0,0,0,0,0
Actinobacteria Actinobacteria Streptosporangiales Nocardiopsaceae,0,0,0,0,0,0,0,0,0,0,0,0,0,0,0,0,0,0,0,0,0,0,0,0
Actinobacteria Coriobacteriia Coriobacteriales Coriobacteriaceae,12,0,0,4,0,0,11,0,0,23,0,0,15,0,0,6,0,0,12,6,0,48,0,0
Actinobacteria Coriobacteriia Eggerthellales Eggerthellaceae,3,2,0,7,0,11,6,2,0,1,0,2,0,0,0,0,0,2,0,5,0,6,0,0
Bacteroidetes Bacteroidia Bacteroidales Bacteroidaceae,206388,101290,146945,29839,145227,77676,186431,113341,163215,46185,118746,74577,197914,95382,133083,39412,117260,128185,180241,145524,146708,45892,145292,90246
Bacteroidetes Bacteroidia Bacteroidales Barnesiellaceae,1319,350,751,657,1201,84,1741,967,1636,990,863,726,1596,651,1175,1453,960,2214,1690,2602,886,1662,342,1384
Bacteroidetes Bacteroidia Bacteroidales Muribaculaceae,12,0,0,0,0,0,3,0,0,0,0,0,5,0,0,0,0,0,0,0,0,0,0,0
Bacteroidetes Bacteroidia Bacteroidales Odoribacteraceae,1021,212,698,363,485,67,770,576,1069,535,600,167,1010,285,1584,547,625,437,886,596,1115,375,164,213
Bacteroidetes Bacteroidia Bacteroidales Porphyromonadaceae,10611,7965,25865,7616,11289,39109,10339,6317,32277,5863,15310,33720,10676,8749,33933,7971,8645,20383,7736,18328,37287,5623,7564,27949
Bacteroidetes Bacteroidia Bacteroidales Prevotellaceae,3967,7598,2912,2,3064,19185,3803,12911,2384,0,550,12287,2463,8143,2937,1,3233,2912,2866,449,2216,1,4790,13898
Bacteroidetes Bacteroidia Bacteroidales Rikenellaceae,5207,1526,1057,989,501,53,5185,3638,3778,1929,1836,235,7543,1924,2295,1580,2235,1976,3407,3037,682,2088,128,1226
Bacteroidetes Bacteroidia Bacteroidales unknown,0,0,0,0,0,0,0,0,0,0,0,0,0,0,0,0,0,0,0,0,0,0,0,0
Bacteroidetes Chitinophagia Chitinophagales Chitinophagaceae,0,0,0,0,0,0,0,0,0,0,0,0,0,0,0,0,0,0,0,0,0,0,0,0
Bacteroidetes Cytophagia Cytophagales Cytophagaceae,0,0,0,0,0,0,0,0,0,0,0,0,0,0,0,0,0,0,0,0,0,0,0,0
Bacteroidetes Flavobacteriia Flavobacteriales Weeksellaceae,0,0,0,0,0,0,0,0,0,0,0,0,0,0,0,0,0,0,0,0,0,0,0,0
Bacteroidetes unknown unknown unknown,0,0,0,0,0,0,0,0,0,0,0,0,0,0,0,0,0,0,0,0,0,0,0,0
Chloroflexi Anaerolineae Anaerolineales Anaerolineaceae,0,0,0,0,0,0,0,0,0,0,0,0,0,0,0,0,0,0,0,0,0,0,0,0
Chloroflexi Caldilineae Caldilineales Caldilineaceae,0,0,0,0,0,0,0,0,0,0,0,0,0,0,0,0,0,0,0,0,0,0,0,0
Cyanobacteria/Chloroplast Chloroplast Chloroplast Streptophyta,0,0,0,0,0,0,0,0,0,0,0,0,0,0,0,0,0,0,0,0,0,0,0,0
Deinococcus-Thermus Deinococci Deinococcales Deinococcaceae,0,0,0,0,0,0,0,0,0,0,0,0,0,0,0,0,0,0,0,0,0,0,0,0
Firmicutes Bacilli Bacillales Bacillaceae_1,0,0,0,0,0,0,0,0,0,0,0,0,0,0,0,0,0,0,0,0,0,0,0,0
Firmicutes Bacilli Bacillales Bacillales_Incertae_Sedis_X,0,0,0,0,0,0,0,0,0,0,0,0,0,0,0,0,0,0,0,0,0,0,0,0
Firmicutes Bacilli Bacillales Paenibacillaceae_1,0,0,0,0,0,0,0,0,0,0,0,0,0,0,0,0,0,0,0,0,0,0,0,0
Firmicutes Bacilli Lactobacillales Enterococcaceae,0,0,0,1,0,0,0,0,0,51,0,0,0,0,0,3,0,0,0,0,0,4,0,0
Firmicutes Bacilli Lactobacillales Lactobacillaceae,0,0,0,0,0,0,0,0,0,0,0,0,0,0,0,1,0,0,0,0,0,0,0,0
Firmicutes Bacilli Lactobacillales Streptococcaceae,11,0,0,239,0,0,9,0,0,234,0,0,0,1,0,475,0,0,0,0,0,358,0,0
Firmicutes Bacilli Lactobacillales unknown,0,0,0,0,0,0,0,0,0,0,0,0,0,0,0,0,0,0,0,0,0,0,0,0
Firmicutes Clostridia Clostridiales Catabacteriaceae,0,0,0,0,0,0,0,0,0,0,0,0,0,0,0,0,0,0,0,0,0,0,0,0
Firmicutes Clostridia Clostridiales Christensenellaceae,0,0,17,121,0,258,2,0,1,85,0,1365,8,8,4,163,4,964,4,76,17,93,0,911
Firmicutes Clostridia Clostridiales Clostridiaceae_1,0,0,0,0,0,0,3,0,0,0,1,0,50,0,0,1,0,0,6,0,0,0,0,0
Firmicutes Clostridia Clostridiales Clostridiales_Incertae_Sedis_XIII,8,5,9,24,69,12,8,40,24,9,30,11,12,11,55,22,55,10,31,4,104,50,193,104
Firmicutes Clostridia Clostridiales Eubacteriaceae,9,13,46,38,11,257,13,5,38,38,6,76,125,14,6,146,47,9,5,37,8,18,11,5
Firmicutes Clostridia Clostridiales Lachnospiraceae,16186,31817,9258,15250,1992,9990,21100,21874,5178,16205,1488,8198,27804,22250,5018,21925,2481,8072,33416,29496,1714,26206,300,7546
Firmicutes Clostridia Clostridiales Peptostreptococcaceae,0,2,0,115,2,0,1,0,0,1,0,0,4,0,0,436,0,0,0,0,3,38,0,0
Firmicutes Clostridia Clostridiales Ruminococcaceae,11492,1027,818,8069,114,2851,9191,1566,759,9309,479,2420,10934,648,741,11018,151,588,3584,1472,970,10164,248,813
Firmicutes Clostridia Clostridiales unknown,232,104,119,172,59,222,282,74,90,172,30,186,994,39,73,158,17,92,248,295,37,169,49,38
Firmicutes Clostridia unknown unknown,0,0,13,0,55,0,0,0,41,0,69,1,0,0,71,0,131,27,1,0,42,0,1,53
Firmicutes Erysipelotrichia Erysipelotrichales Erysipelatoclostridiaceae,12,70,53,39,149,205,99,81,17,130,95,299,23,72,21,10,329,88,86,255,3,328,403,45
Firmicutes Erysipelotrichia Erysipelotrichales Erysipelotrichaceae,642,329,1340,2176,10282,1085,529,671,1852,2175,3527,768,870,357,4188,2618,6511,983,605,624,7091,2869,12382,2952
Firmicutes Erysipelotrichia Erysipelotrichales unknown,0,0,0,0,0,0,0,0,0,0,0,0,0,0,0,0,2,0,0,0,0,0,0,0
Firmicutes Negativicutes Acidaminococcales Acidaminococcaceae,6998,5090,6019,4801,15714,4151,9311,5417,4999,3806,11892,4054,11484,2129,4557,2819,10273,4945,9307,9364,6651,2000,9596,4771
Firmicutes Negativicutes Selenomonadales Selenomonadaceae,0,0,0,0,0,0,0,0,0,0,0,0,0,0,0,0,0,0,0,0,0,0,0,0
Firmicutes Negativicutes Veillonellales Veillonellaceae,0,0,0,0,0,0,0,0,0,0,0,0,0,0,0,0,0,0,0,0,0,1,0,0
Firmicutes Negativicutes unknown unknown,0,0,0,0,0,0,0,0,0,0,0,0,0,0,0,0,0,0,0,0,0,0,0,0
Firmicutes unknown unknown unknown,0,2,0,5,0,4,69,104,1,2208,0,0,1,14,2,14,0,0,74,116,3,2413,0,1
Fusobacteria Fusobacteriia Fusobacteriales Fusobacteriaceae,2,1,0,1,0,0,0,0,0,3,0,0,0,0,0,0,0,0,0,0,0,0,3,0
Lentisphaerae Lentisphaeria Victivallales Victivallaceae,1,0,0,0,0,0,0,0,0,0,0,0,1,0,2,0,0,0,5,1,1,0,0,0
Proteobacteria Alphaproteobacteria Caulobacterales Caulobacteraceae,0,0,0,0,0,0,0,0,0,0,0,0,0,0,0,0,0,0,0,0,0,0,0,0
Proteobacteria Alphaproteobacteria Kiloniellales Kiloniellaceae,0,0,0,0,0,0,0,0,0,0,0,0,0,0,0,0,0,0,0,0,0,0,0,0
Proteobacteria Alphaproteobacteria Rhizobiales Aurantimonadaceae,0,0,0,0,0,0,0,0,0,0,0,0,0,0,0,0,0,0,0,0,0,0,0,0
Proteobacteria Alphaproteobacteria Rhizobiales Boseaceae,0,0,0,0,0,0,0,0,0,0,0,0,0,0,0,0,0,0,0,0,0,0,0,0
Proteobacteria Alphaproteobacteria Rhizobiales Bradyrhizobiaceae,0,0,0,0,0,0,0,0,0,0,0,0,0,0,0,0,0,0,0,0,0,0,0,0
Proteobacteria Alphaproteobacteria Rhizobiales Devosiaceae,0,0,0,0,0,0,0,0,0,0,0,0,0,0,0,0,0,0,0,0,0,0,0,0
Proteobacteria Alphaproteobacteria Rhizobiales Pleomorphomonadaceae,0,0,0,0,0,0,0,0,0,0,0,0,0,0,0,0,0,0,0,0,0,0,0,0
Proteobacteria Alphaproteobacteria Rhizobiales Rhizobiaceae,0,0,0,0,0,0,0,0,0,0,0,0,0,0,0,0,0,0,0,0,0,0,0,0
Proteobacteria Alphaproteobacteria Rhizobiales Stappiaceae,0,0,0,0,0,0,0,0,0,0,0,0,0,0,0,0,0,0,0,0,0,0,0,0
Proteobacteria Alphaproteobacteria Rhizobiales unknown,0,0,0,0,0,0,0,0,0,0,0,0,0,0,0,0,0,0,0,0,0,0,0,0
Proteobacteria Alphaproteobacteria Rhodobacterales Rhodobacteraceae,0,0,0,0,0,0,0,0,0,0,0,0,0,0,0,0,0,0,0,0,0,0,0,0
Proteobacteria Alphaproteobacteria Rhodospirillales Azospirillaceae,0,0,0,0,0,0,0,0,0,0,0,0,0,0,0,0,0,0,0,0,0,0,0,0
Proteobacteria Alphaproteobacteria Rhodospirillales Rhodospirillaceae,0,0,0,0,0,0,0,0,0,0,0,0,0,0,0,0,0,0,0,0,0,0,0,0
Proteobacteria Alphaproteobacteria Rhodospirillales unknown,0,0,0,0,0,0,0,0,0,0,0,0,0,0,0,0,0,0,0,0,0,0,0,0
Proteobacteria Alphaproteobacteria Sphingomonadales Erythrobacteraceae,0,0,0,0,0,0,0,0,0,0,0,0,0,0,0,0,0,0,0,0,0,0,0,0
Proteobacteria Alphaproteobacteria Sphingomonadales Sphingomonadaceae,0,0,0,0,0,0,0,0,0,0,0,0,0,0,0,0,0,0,0,0,0,0,0,0
Proteobacteria Alphaproteobacteria Sphingomonadales Sphingosinicellaceae,0,0,0,0,0,0,0,0,0,0,0,0,0,0,0,0,0,0,0,0,0,0,0,0
Proteobacteria Betaproteobacteria Burkholderiales Burkholderiaceae,0,0,0,0,0,0,0,0,0,0,0,0,0,0,0,0,0,0,0,0,0,0,0,0
Proteobacteria Betaproteobacteria Burkholderiales Comamonadaceae,0,0,0,0,0,0,0,0,0,0,0,0,0,0,0,0,0,0,0,0,0,0,0,0
Proteobacteria Betaproteobacteria Burkholderiales Oxalobacteraceae,76,0,0,1,0,0,76,31,62,1,4,144,87,27,42,0,5,79,80,0,5,0,0,124
Proteobacteria Betaproteobacteria Burkholderiales Sutterellaceae,27097,12388,10865,1046,1451,15489,24302,16187,11417,968,2541,8616,20665,11801,5409,1086,8478,6967,13557,10454,1418,1581,3387,10314
Proteobacteria Betaproteobacteria Burkholderiales unknown,0,0,0,0,0,0,0,0,0,0,0,0,0,0,0,0,0,0,0,0,0,0,0,0
Proteobacteria Deltaproteobacteria Bdellovibrionales Bdellovibrionaceae,0,0,0,0,0,0,0,0,0,0,0,0,0,0,0,0,0,0,0,0,0,0,0,0
Proteobacteria Deltaproteobacteria Desulfovibrionales Desulfovibrionaceae,2434,1059,1823,11736,2504,3919,2354,2121,2668,18707,1397,2611,2671,945,2144,9909,2083,2068,1733,582,2428,7781,3075,4657
Proteobacteria Deltaproteobacteria unknown unknown,0,0,0,0,0,0,0,0,0,0,0,0,0,0,0,0,0,0,0,0,0,0,0,0
Proteobacteria Gammaproteobacteria Chromatiales Chromatiaceae,0,0,0,0,0,0,0,0,0,0,0,0,0,0,0,0,0,0,0,0,0,0,0,0
Proteobacteria Gammaproteobacteria Enterobacterales Enterobacteriaceae,4,1,5983,264,75575,3503,0,26,9506,11,21153,1536,0,0,8558,490,42971,1666,0,43,11258,98,60324,8817
Proteobacteria Gammaproteobacteria Enterobacterales Morganellaceae,2,0,0,0,0,0,0,0,0,0,0,0,0,0,0,3,0,0,0,0,0,0,0,0
Proteobacteria Gammaproteobacteria Legionellales Legionellaceae,0,0,0,0,0,0,0,0,0,0,0,0,0,0,0,0,0,0,0,0,0,0,0,0
Proteobacteria Gammaproteobacteria Pasteurellales Pasteurellaceae,0,0,0,0,0,0,0,0,0,0,0,0,0,0,0,0,0,0,0,0,0,0,0,0
Proteobacteria Gammaproteobacteria Pseudomonadales Moraxellaceae,0,0,0,0,0,0,0,0,28,0,0,3,0,0,0,0,0,0,0,0,0,0,0,0
Proteobacteria Gammaproteobacteria Pseudomonadales Pseudomonadaceae,0,0,0,0,0,0,0,0,0,0,0,0,0,0,0,0,0,0,0,0,0,0,0,0
Proteobacteria Gammaproteobacteria Xanthomonadales Xanthomonadaceae,0,0,0,0,0,0,0,0,0,0,0,0,0,0,0,0,0,0,0,0,0,0,0,0
Proteobacteria Hydrogenophilalia Hydrogenophilales Hydrogenophilaceae,0,0,0,0,0,0,0,0,0,0,0,0,0,0,0,0,0,0,0,0,0,0,0,0
Proteobacteria Oligoflexia Bacteriovoracales Bacteriovoracaceae,0,0,0,0,0,0,0,0,0,0,0,0,0,0,0,0,0,0,0,0,0,0,0,0
Proteobacteria unknown unknown unknown,1669,699,1433,2,69,10,119,679,0,40,1520,8,174,32,131,0,2989,918,1262,345,18,31,15,7
Verrucomicrobia Verrucomicrobiae Verrucomicrobiales Akkermansiaceae,38159,38827,11911,83156,4059,312,37749,25568,26728,73388,18562,2138,55642,29471,24055,60569,16048,10455,45014,13989,15604,68627,19301,941
Verrucomicrobia Verrucomicrobiae Verrucomicrobiales unknown,0,0,0,0,0,0,0,0,0,0,0,0,0,0,0,0,0,0,0,0,0,0,0,0
unknown unknown unknown unknown,18,2,0,0,0,0,13,7,3,0,0,4,17,0,0,0,0,2,0,0,0,0,0,5
